{
  "edition_id": "chinese-open",
  "version": "0.1.0",
  "nodes": [
    {
      "id": "language-tree-hub",
      "label": "语言树中枢",
      "subject": "language-tree-hub",
      "node_type": "hub",
      "abstraction_level": "L0_meta",
      "summary": "中文开源知识网的中心入口，负责意图、词汇、语法、语义抽象、联想迁移、表达和验证。",
      "source_refs": [],
      "content_refs": [
        "cu-language-tree-001",
        "cu-route-scope-001",
        "cu-language-thought-layer-selection-001",
        "cu-language-semantic-adaptation-001",
        "cu-language-directory-index-001"
      ],
      "fame": {
        "mu": 0.6,
        "chi": 0.75,
        "epsilon": 0.65,
        "kappa": 0.65,
        "nu": 0.55,
        "delta": 0,
        "rho": 0.55,
        "risk": 0.2
      }
    },
    {
      "id": "language-multi-path-association",
      "label": "多路径横向联想",
      "subject": "language-tree-hub",
      "node_type": "route",
      "abstraction_level": "L4_method",
      "summary": "从语言树生成多条候选路线，用 FAME、风险、预算和验证钩子筛选，支持回溯和失败教训保留。",
      "source_refs": [
        "react-paper",
        "tree-of-thoughts-paper"
      ],
      "content_refs": [
        "cu-language-multi-path-association-001"
      ],
      "fame": {
        "mu": 0.58,
        "chi": 0.7,
        "epsilon": 0.62,
        "kappa": 0.62,
        "nu": 0.82,
        "delta": 0.02,
        "rho": 0.46,
        "risk": 0.28
      }
    },
    {
      "id": "language-abstraction-transfer",
      "label": "抽象迁移落地",
      "subject": "language-tree-hub",
      "node_type": "route",
      "abstraction_level": "L4_method",
      "summary": "把具体任务上提到方法和学科层，横向迁移可验证结构，再落回最小可执行动作。",
      "source_refs": [
        "tree-of-thoughts-paper",
        "self-refine-paper"
      ],
      "content_refs": [
        "cu-language-abstraction-transfer-001"
      ],
      "fame": {
        "mu": 0.6,
        "chi": 0.68,
        "epsilon": 0.66,
        "kappa": 0.64,
        "nu": 0.78,
        "delta": 0.02,
        "rho": 0.48,
        "risk": 0.26
      }
    },
    {
      "id": "logic",
      "label": "逻辑",
      "subject": "logic",
      "node_type": "discipline",
      "abstraction_level": "L1_discipline",
      "summary": "为 Agent 提供论证、证明、反例、一致性检查和失败复盘能力。",
      "source_refs": [
        "sep-logic",
        "open-logic-project"
      ],
      "content_refs": [
        "cu-logic-argument-001",
        "cu-logic-temporal-invariant-001"
      ],
      "fame": {
        "mu": 0.55,
        "chi": 0.6,
        "epsilon": 0.7,
        "kappa": 0.55,
        "nu": 0.35,
        "delta": 0,
        "rho": 0.45,
        "risk": 0.2
      }
    },
    {
      "id": "logic-tool-precheck",
      "label": "工具调用前逻辑预检",
      "subject": "logic",
      "node_type": "route",
      "abstraction_level": "L5_operation",
      "summary": "调用工具前检查目标、前提、schema、作用域、副作用和验证方式是否齐备。",
      "source_refs": [
        "sep-logic",
        "open-logic-project"
      ],
      "content_refs": [
        "cu-logic-tool-precheck-001"
      ],
      "fame": {
        "mu": 0.64,
        "chi": 0.76,
        "epsilon": 0.74,
        "kappa": 0.72,
        "nu": 0.35,
        "delta": 0.03,
        "rho": 0.58,
        "risk": 0.16
      }
    },
    {
      "id": "logic-failure-diagnosis",
      "label": "失败诊断逻辑",
      "subject": "logic",
      "node_type": "route",
      "abstraction_level": "L5_operation",
      "summary": "把失败拆成观察事实、候选原因、区分性测试、修复动作和 FAME 更新候选。",
      "source_refs": [
        "sep-logic",
        "open-logic-project"
      ],
      "content_refs": [
        "cu-logic-failure-diagnosis-001"
      ],
      "fame": {
        "mu": 0.58,
        "chi": 0.68,
        "epsilon": 0.72,
        "kappa": 0.62,
        "nu": 0.48,
        "delta": 0.02,
        "rho": 0.5,
        "risk": 0.22
      }
    },
    {
      "id": "logic-knowledge-consistency",
      "label": "知识录入一致性",
      "subject": "logic",
      "node_type": "route",
      "abstraction_level": "L5_operation",
      "summary": "新增知识前检查学科层级、抽象层级、来源、许可证、详细内容位置和 FAME 依据。",
      "source_refs": [
        "cn-gbt-13745-2009",
        "cn-moe-graduate-catalog-2022"
      ],
      "content_refs": [
        "cu-logic-knowledge-consistency-001"
      ],
      "fame": {
        "mu": 0.6,
        "chi": 0.7,
        "epsilon": 0.76,
        "kappa": 0.65,
        "nu": 0.35,
        "delta": 0.02,
        "rho": 0.55,
        "risk": 0.18
      }
    },
    {
      "id": "mathematics",
      "label": "数学",
      "subject": "mathematics",
      "node_type": "discipline",
      "abstraction_level": "L1_discipline",
      "summary": "提供形式化、建模、证明、计算和不确定性处理能力。",
      "source_refs": [
        "math-msc2020"
      ],
      "content_refs": [
        "cu-math-modeling-001"
      ],
      "fame": {
        "mu": 0.5,
        "chi": 0.5,
        "epsilon": 0.65,
        "kappa": 0.45,
        "nu": 0.4,
        "delta": 0,
        "rho": 0.35,
        "risk": 0.25
      }
    },
    {
      "id": "math-graph-traversal-route",
      "label": "图遍历找球门",
      "subject": "mathematics",
      "node_type": "route",
      "abstraction_level": "L5_operation",
      "summary": "按作用域、边预算、FAME 分数、风险和上下文预算寻找候选知识路线。",
      "source_refs": [
        "math-msc2020"
      ],
      "content_refs": [
        "cu-math-graph-traversal-001"
      ],
      "fame": {
        "mu": 0.62,
        "chi": 0.72,
        "epsilon": 0.68,
        "kappa": 0.72,
        "nu": 0.58,
        "delta": 0.02,
        "rho": 0.52,
        "risk": 0.2
      }
    },
    {
      "id": "math-evidence-update",
      "label": "证据驱动参数更新",
      "subject": "mathematics",
      "node_type": "route",
      "abstraction_level": "L5_operation",
      "summary": "用测试、工具结果、人工反馈和失败样本更新 FAME 参数。",
      "source_refs": [
        "math-msc2020"
      ],
      "content_refs": [
        "cu-math-evidence-update-001"
      ],
      "fame": {
        "mu": 0.6,
        "chi": 0.68,
        "epsilon": 0.76,
        "kappa": 0.62,
        "nu": 0.45,
        "delta": 0.02,
        "rho": 0.55,
        "risk": 0.18
      }
    },
    {
      "id": "math-route-optimization",
      "label": "路线评分与优化",
      "subject": "mathematics",
      "node_type": "route",
      "abstraction_level": "L5_operation",
      "summary": "用目标、约束、权重、风险惩罚和上下文成本比较候选路线。",
      "source_refs": [
        "math-msc2020"
      ],
      "content_refs": [
        "cu-math-route-optimization-001"
      ],
      "fame": {
        "mu": 0.58,
        "chi": 0.66,
        "epsilon": 0.7,
        "kappa": 0.68,
        "nu": 0.42,
        "delta": 0.01,
        "rho": 0.5,
        "risk": 0.2
      }
    },
    {
      "id": "computer-science",
      "label": "计算机科学",
      "subject": "computer-science",
      "node_type": "discipline",
      "abstraction_level": "L1_discipline",
      "summary": "提供软件、系统、数据、AI、安全、HCI 和开源治理知识。",
      "source_refs": [
        "acm-ccs-2012",
        "acm-cs2023",
        "github-actions-security-hardening"
      ],
      "content_refs": [
        "cu-cs-kg-001",
        "cu-cs-kg-indexing-001",
        "cu-cs-kg-light-graph-heavy-store-001",
        "cu-cs-database-schema-versioning-001",
        "cu-cs-ci-security-hardening-001",
        "cu-cs-release-artifact-provenance-001"
      ],
      "fame": {
        "mu": 0.55,
        "chi": 0.6,
        "epsilon": 0.6,
        "kappa": 0.6,
        "nu": 0.35,
        "delta": 0,
        "rho": 0.45,
        "risk": 0.25
      }
    },
    {
      "id": "cs-spec-to-test",
      "label": "规格到测试",
      "subject": "computer-science",
      "node_type": "route",
      "abstraction_level": "L5_operation",
      "summary": "把用户目标转成可观察行为、验收标准和测试路径，执行后写回证据摘要。",
      "source_refs": [
        "acm-cs2023"
      ],
      "content_refs": [
        "cu-cs-spec-to-test-001"
      ],
      "fame": {
        "mu": 0.66,
        "chi": 0.76,
        "epsilon": 0.78,
        "kappa": 0.72,
        "nu": 0.32,
        "delta": 0.04,
        "rho": 0.58,
        "risk": 0.16
      }
    },
    {
      "id": "cs-kg-indexing",
      "label": "知识图谱与索引工程",
      "subject": "computer-science",
      "node_type": "route",
      "abstraction_level": "L5_operation",
      "summary": "用轻图谱、内容数据库、规则库、别名索引、语义索引和作用域检索支撑大知识网扩展。",
      "source_refs": [
        "acm-ccs-2012"
      ],
      "content_refs": [
        "cu-cs-kg-indexing-001"
      ],
      "fame": {
        "mu": 0.64,
        "chi": 0.74,
        "epsilon": 0.72,
        "kappa": 0.72,
        "nu": 0.48,
        "delta": 0.03,
        "rho": 0.56,
        "risk": 0.18
      }
    },
    {
      "id": "cs-agent-memory-loop",
      "label": "Agent 工程记忆闭环",
      "subject": "computer-science",
      "node_type": "route",
      "abstraction_level": "L5_operation",
      "summary": "把目标、工具事件、测试证据、失败教训和恢复点写入工程记忆 overlay。",
      "source_refs": [
        "acm-cs2023"
      ],
      "content_refs": [
        "cu-cs-agent-memory-loop-001"
      ],
      "fame": {
        "mu": 0.68,
        "chi": 0.78,
        "epsilon": 0.74,
        "kappa": 0.7,
        "nu": 0.45,
        "delta": 0.04,
        "rho": 0.6,
        "risk": 0.18
      }
    },
    {
      "id": "cs-open-source-release-gate",
      "label": "开源发布门禁",
      "subject": "computer-science",
      "node_type": "route",
      "abstraction_level": "L5_operation",
      "summary": "发布前检查许可证、来源登记、密钥路径、文档、专用校验和残余风险。",
      "source_refs": [
        "acm-cs2023"
      ],
      "content_refs": [
        "cu-cs-open-source-release-gate-001"
      ],
      "fame": {
        "mu": 0.64,
        "chi": 0.72,
        "epsilon": 0.8,
        "kappa": 0.68,
        "nu": 0.3,
        "delta": 0.03,
        "rho": 0.58,
        "risk": 0.14
      }
    },
    {
      "id": "agent-tooling",
      "label": "Agent 工具调取",
      "subject": "agent-tooling",
      "node_type": "discipline",
      "abstraction_level": "L1_discipline",
      "summary": "为 Agent 提供工具说明读取、schema 校验、审批、执行、摘要和失败复盘机制。",
      "source_refs": [
        "mcp-docs-intro",
        "mcp-tools-spec",
        "openai-tools-docs",